name,sort
キャッチ―なかべ,たぬき商店
ピンクハートのかべがみ,たぬき商店
モノクロタイルのかべ,たぬき商店
イエローストライプのかべがみ,たぬき商店
きいろいテキストタイルのかべ,たぬき商店
きれいなガラスのかべ,たぬき商店
ピンクキルトのかべ,たぬき商店
ももいろダイナーのかべ,たぬき商店
ちかろうのかべ,ローラン
キッスのかべ,ローラン
ちそうのかべ,ローラン
あらしのよるのかべ,ローラン
おおうなばらのかべ,ローラン
やけいのかべ,ローラン
いせきのかべ,ローラン
きゅうでんのかべがみ,ローラン
ホワイトチョコなかべがみ,ローラン
こさめのふるかべ,ローラン
あきちのかべ,ローラン
つたのかべ,ローラン
こうやのかべ,ローラン
がいろじゅのかべ,ローラン
ふしぎなかべがみ,ローラン
サーバールームのかべ,ローラン
カフェカーテンのかべ,ローラン
しっくいのへい,ローラン
まてんろうのかべ,ローラン
おうちょうのかべ,ローラン
アトリエなかべ,ローラン
ボルダリングのかべ,ローラン
さばくなかべ,ローラン
こけにわのかべがみ,ローラン
すいへいせんのかべ,ローラン
ストリートアートのかべ,ローラン
かざんどつくつのかべ,ローラン
スタジアムのかべ,ローラン
きばんのかべ,ローラン
きんこのかべ,ローラン
チャイナなかべ,ローラン
エジプトなかべ,ローラン
オーバーテクノロジーなかべ,ローラン
どんちょうのかべ,ローラン
けいこべやのかべ,ローラン
オフィスのかべ,ローラン
でんえんふうけいのかべ,ローラン
カフェカーテンのかべ,ローラン
ラボのかべ,ローラン
はいきょのかべ,ローラン
いちごチョコアソートなゆか,ローラン
シャッターのかべ,ローラン
チャイナなかべ,ローラン
かざんどうくつのかべ,ローラン
プロレスのかべ,ローラン
いちごチョコなかべ,ローラン
こくばんのかべ,ローラン
さんちょうのかべ,ローラン
スタジアムのかべ,ローラン
うらにわのかべ,ローラン
ミックスウッドのかべ,DIY
ちゃいろいヘリンボーンのかべ,DIY
ゴミのやまなかべ,DIY
さくらなみきのかべ,DIY
みなみのうみなかべ,DIY
よせぎのかべ,DIY
ウッディなかべ,DIY
バンブーなかべ,DIY
ランダムストーンのかべ,DIY
ジャングルのかべがみ,DIY
ビーハイブなかべ,DIY
こげちゃのヘリンボーンのかべ,DIY
スノーフレークのかべがみ,DIY
ワイルドウッドのかべ,DIY
イースターなかべがみ,DIY
アイスなかべがみ,DIY
さくらのウッドウォール,DIY
キノコのかべがみ,DIY
キノコのもりのかべ,DIY
こうようのかべ,DIY
ほしぞらのかべ,DIY
スターなかべ,DIY
うちゅうせんのかべ,DIY
いしのかべ,DIY
おうごんのかべ,DIY
きんぱくのふすま,DIY
さくらんぼのかべがみ,DIY
じゅかいなかべ,DIY
ダークなよせぎのかべ,DIY
ちくりんのかべ,DIY
ナシのかべがみ,DIY
ふしありウッドウォール,DIY
まんがライブラリーなかべ,DIY
モモのかべがみ,DIY
ライブラリーなかべ,DIY
リンゴのかべがみ,DIY
オレンジのかべがみ,DIY
おサカナのかべがみ,釣り大会
しろいシンプルクロス,たぬき商店